{
  "pack_id": "TX_GAME_ENERGY_V1",
  "schema_version": "0.1.0",
  "evidence": "GATE",
  "claims_complete_source_coverage": false,
  "completeness": "incomplete",
  "source_batch_count": 88,
  "rights_status": "terms_accepted_internal_use_only",
  "quality_grade": "blocked",
  "source_period": {
    "start": "2021-02-01",
    "end": "2025-12-31"
  },
  "operating_days": [],
  "selected_proxy_points": [
    {
      "site_id": "fictional.bayou-bend",
      "display_name": "Bayou Bend Energy",
      "evidence": "PROXY",
      "approximate_setting": "Inland Gulf Coast near the Houston area",
      "starter_price_family": "Houston-associated proxy",
      "proxy_grade": "hub_fallback_unassigned",
      "source_point_id": null,
      "covered_local_dates": []
    },
    {
      "site_id": "fictional.prairie-junction",
      "display_name": "Prairie Junction Power",
      "evidence": "PROXY",
      "approximate_setting": "North Texas outside the Dallas area",
      "starter_price_family": "North-associated proxy",
      "proxy_grade": "hub_fallback_unassigned",
      "source_point_id": null,
      "covered_local_dates": []
    },
    {
      "site_id": "fictional.mesquite-ridge",
      "display_name": "Mesquite Ridge Generation",
      "evidence": "PROXY",
      "approximate_setting": "Inland South Texas",
      "starter_price_family": "South-associated proxy",
      "proxy_grade": "hub_fallback_unassigned",
      "source_point_id": null,
      "covered_local_dates": []
    },
    {
      "site_id": "fictional.red-mesa",
      "display_name": "Red Mesa Peaking",
      "evidence": "PROXY",
      "approximate_setting": "West Texas",
      "starter_price_family": "West-associated proxy",
      "proxy_grade": "hub_fallback_unassigned",
      "source_point_id": null,
      "covered_local_dates": []
    }
  ],
  "ancillary_service_price_families": [],
  "ancillary_service_selection": {
    "selected": false,
    "reason": "Release 1 is the energy-only module. No ancillary-service price family is selected. The coverage gate checks every selected family; it does not invent an AS series (\u00a74, \u00a720, \u00a728.2)."
  },
  "gap_report": {
    "status": "blocked",
    "reason": "source_batch_count is 88 verified price-instance zips (batch 1: 6, batch 2: 6, batch 3: 13, batch 4: 24, batch 5: 14, batch 6: 25). No batch 6 zip failed its sidecar. Batch 6 is Data/archives/ercot/2026-09-24/batch6. Fourteen NP4 archive zips posted 2021-04-14 through 2024-01-14. Their CSV DeliveryDate is the next civil day, including 2021-04-15, 2022-07-15, 2023-01-15, 2023-04-15, and 2022-11-15. Eleven NP6 zips are one interval each, including 2021-04-15 hour 12 interval 4, 2022-07-15 hour 12 interval 3, 2023-01-15 hour 12 interval 3, and 2023-04-15 hour 12 interval 3. Live deliveryDateFrom/To is empty (totalRecords 0) for 2022-11-15 on both products. 2024-05-15 and 2025-09-15 From/To pages have rows but only pages 1-3 were retained. No batch 5 zip failed its sidecar. JSON listings and artifact pages are not counted. Batch 5 is Data/archives/ercot/2026-09-24/batch5. Seven NP4 archive zips posted 2021-02-14 through 2022-07-16 (docIds 758641836, 763408356, 768828508, 784624476, 817680531, 828536499, 852119649). Proven NP4 CSV DeliveryDate values in this drop are the next civil day, with hour endings 01:00 through 24:00. Seven NP6 zips are one interval each (docIds 759415177, 768651349, 817499214, 774460998, 785365684, 800246894, 811491049). The NP6 zip posted 2021-04-15 is hour 12 interval 3, not a full day. The NP6 zip posted 2021-10-12 has DeliveryDate 10/11/2021, hour 24 interval 4. Live deliveryDateFrom/To is empty (totalRecords 0) for 2021-04-15, 2022-07-15, and 2023-04-15 on both NP4-190-CD and NP6-905-CD, so those days still need archive ?download= or the ER products. The NP4 zip posted 2021-04-16 covers DeliveryDate 04/17/2021, not 2021-04-15. The NP4 zip posted 2022-07-16 covers DeliveryDate 07/17/2022, not 2022-07-15. No batch 4 zip failed its sidecar. JSON listings and artifact pages are not counted. Batch 4 is Data/archives/ercot/2026-09-24/batch4. Ten NP6 landmark zips are one interval each (hour 12, interval 3) posted 2021-06-20 through 2025-03-15 (docIds 780039888, 793006546, 846902783, 867649897, 895996716, 937884071, 985866907, 1012057209, 1076607155, 1085818452). Fourteen NP4 archive zips posted 2021-05-16 through 2025-09-15 (docIds 773997684, 812053445, 823014576, 864393539, 883319168, 889808030, 902478925, 936965305, 965447681, 988639722, 1020166966, 1052688105, 1094526170, 1140793955). Proven NP4 CSV DeliveryDate values are the next civil day, with hour endings 01:00 through 24:00. Those are market files, not proxy coverage. Live deliveryDateFrom/To is empty (totalRecords 0) for 2023-01-15 on both NP4-190-CD and NP6-905-CD, so that day still needs archive ?download= or the ER products. The NP4 zip posted 2023-01-16 covers DeliveryDate 01/17/2023, not 2023-01-15. 2025-06-15, 2024-10-15, and 2024-01-15 From/To pages have rows but only pages 1-3 were retained, which is not a full day. Earlier batches stay as recorded in their RETENTION notes, including the three 2026-09-24 RT zips that are not campaign days and the empty artifact days 2021-02-15, 2021-08-15, 2022-02-15, and 2023-08-15. Proxy covered_local_dates stay empty and source_point_id stays null. claims_complete_source_coverage stays false. Five-year coverage is incomplete. NP4-180-ER and NP6-785-ER stay absent from the Public API catalog and are still required by spec section 5.1. Next research is an EWS/EMIL historic route. No Public API slug is invented. Owner-approved internal redistribution into packs only (Austin and coworkers; not for sale). Commercial App Store redistribution is not claimed. RetainedSettlementArchive can open verified batch2, batch3, batch4, and batch5 price zips and parse the CSV member after the sha256 sidecar matches. That read path is retained samples only and is not complete coverage. RetainedSampleInventory lists CSV delivery dates from those zips in Data/archives/ercot/2026-09-24/retained-sample-inventory.json. That list is not proxy covered_local_dates and is not a complete-coverage claim."
  },
  "training_archive": {
    "archive_id": "TX_TRAIN_2019_2020",
    "label": "training-only",
    "period_start": "2019-01-01",
    "period_end": "2020-12-31",
    "completeness": "incomplete",
    "source_batch_count": 0
  },
  "source_products": [
    {
      "product_id": "NP4-190-CD",
      "role": "dam_settlement_point_prices",
      "status": "partial_batches_retained",
      "pinned_api_path": "https://api.ercot.com/api/public-reports/np4-190-cd/dam_stlmnt_pnt_prices"
    },
    {
      "product_id": "NP6-905-CD",
      "role": "rt_settlement_point_prices",
      "status": "partial_batches_retained",
      "pinned_api_path": "https://api.ercot.com/api/public-reports/np6-905-cd/spp_node_zone_hub"
    },
    {
      "product_id": "NP4-180-ER",
      "role": "annual_hub_load_zone_da_archive",
      "status": "absent_from_public_reports_catalog",
      "pinned_api_path": null
    },
    {
      "product_id": "NP6-785-ER",
      "role": "annual_hub_load_zone_rt_archive",
      "status": "absent_from_public_reports_catalog",
      "pinned_api_path": null
    }
  ],
  "content_hash": null,
  "collection_time": null,
  "effective_rule_profiles": [
    "TX_GAME_ENERGY_V1"
  ],
  "point_manifest_hash": null,
  "proxy_mapping_hash": null,
  "available_features": [],
  "settlement_revision_policy": "unspecified_until_ingest",
  "reconstructed_inputs": [],
  "training_cutoff": null
}
